{
  "action_contract_id": "robot.tank.pick",
  "analysis": {
    "continuous_link_bound_status": "computed-conservative-partial",
    "environment_collision_status": "not-evaluated-frame-unregistered",
    "overall_result": "unknown",
    "self_collision_status": "candidate-overlap"
  },
  "candidate_digest": "eeab36254151171aacdaaca9c353910dd3442c87bcf81c2c3e6f1fff3946afda",
  "coverage": {
    "continuous_evaluated_move_j_segments": 4,
    "excluded_move_j_cp_segments": 3,
    "excluded_move_l_segments": 7,
    "total_motion_segments": 14
  },
  "limitations": [
    "partial-analysis-excludes-move-l-and-cp-segments",
    "controller-interpolation-assumption-not-verified-on-hardware",
    "aabb-overlap-is-candidate-not-exact-collision",
    "adjacent-link-collision-not-evaluated",
    "environment-frame-registration-unqualified",
    "dynamic-tool-and-payload-geometry-missing",
    "stop-and-recovery-envelopes-missing",
    "not-bound-into-v0-occupancy-certificate",
    "qualification-candidate-partial-only"
  ],
  "method": {
    "bound": "per-subinterval-link-aabb-expanded-by-summed-joint-arc-length",
    "eligible_segment_rule": "move_j-and-cp-equals-zero",
    "interpolation_assumption": "linear-controller-joint-space",
    "self_collision_pair_rule": "exclude-identical-and-adjacent-links"
  },
  "mode": "shadow",
  "partial_world_aabb": {
    "max_m": [
      0.002005457751,
      0.398957043707,
      1.032190470708
    ],
    "min_m": [
      -0.801088099208,
      -0.407161000698,
      0.178497250788
    ]
  },
  "qualification": "candidate-partial",
  "sample_id": "eit-ptlc-historical-v1",
  "schema": "lab.continuous-collision-candidate/v0",
  "segments": [
    {
      "cp": 0.0,
      "interval_count": 49,
      "link_envelopes": [
        {
          "conservative_aabb_union": {
            "max_m": [
              -0.257428121111,
              0.118217581472,
              0.249497251325
            ],
            "min_m": [
              -0.405434165439,
              -0.075683391133,
              0.178497250788
            ]
          },
          "link_id": "base_link",
          "max_subinterval_displacement_bound_m": 0.0
        },
        {
          "conservative_aabb_union": {
            "max_m": [
              -0.248686802572,
              0.089670697403,
              0.40973114464
            ],
            "min_m": [
              -0.418359354507,
              -0.084396959693,
              0.241763354373
            ]
          },
          "link_id": "Link1",
          "max_subinterval_displacement_bound_m": 0.000733897786
        },
        {
          "conservative_aabb_union": {
            "max_m": [
              -0.251743576699,
              0.250786247927,
              0.773238335533
            ],
            "min_m": [
              -0.801088099208,
              -0.12455771737,
              0.232526945922
            ]
          },
          "link_id": "Link2",
          "max_subinterval_displacement_bound_m": 0.006033992197
        },
        {
          "conservative_aabb_union": {
            "max_m": [
              -0.163951649376,
              0.129526294898,
              0.945875459345
            ],
            "min_m": [
              -0.746635866432,
              -0.232528817842,
              0.515259363442
            ]
          },
          "link_id": "Link3",
          "max_subinterval_displacement_bound_m": 0.009971747835
        },
        {
          "conservative_aabb_union": {
            "max_m": [
              -0.179946125102,
              0.217489417928,
              0.91663669333
            ],
            "min_m": [
              -0.547462968095,
              0.009718585618,
              0.783751524623
            ]
          },
          "link_id": "Link4",
          "max_subinterval_displacement_bound_m": 0.011491565117
        },
        {
          "conservative_aabb_union": {
            "max_m": [
              -0.091726501685,
              0.240676029971,
              0.967549379125
            ],
            "min_m": [
              -0.421188444526,
              0.073708284149,
              0.751491850663
            ]
          },
          "link_id": "Link5",
          "max_subinterval_displacement_bound_m": 0.013948018872
        },
        {
          "conservative_aabb_union": {
            "max_m": [
              -0.078186920471,
              0.261112950292,
              0.818645527961
            ],
            "min_m": [
              -0.415274770131,
              0.072608448446,
              0.709461970822
            ]
          },
          "link_id": "Link6",
          "max_subinterval_displacement_bound_m": 0.021766873867
        }
      ],
      "motion": "move_j",
      "payload_state": "empty",
      "phase": "approach",
      "reason_codes": [
        "linear-joint-interpolation-conservative-bound",
        "self-collision-broad-phase-only",
        "self-collision-candidate-overlap"
      ],
      "segment_index": 0,
      "segment_world_aabb": {
        "max_m": [
          -0.078186920471,
          0.261112950292,
          0.967549379125
        ],
        "min_m": [
          -0.801088099208,
          -0.232528817842,
          0.178497250788
        ]
      },
      "self_collision": {
        "candidate_overlap_pair_count": 6,
        "evaluated_pair_count": 15,
        "pairs": [
          {
            "candidate_interval_indices": [
              0,
              1,
              2,
              3,
              4,
              5,
              6,
              7,
              8,
              9,
              10,
              11,
              12,
              13,
              14,
              15,
              16,
              17,
              18,
              19,
              20,
              21,
              22,
              23,
              24,
              25,
              26,
              27,
              28,
              29,
              30,
              31,
              32,
              33,
              34,
              35,
              36,
              37,
              38,
              39,
              40,
              41,
              42,
              43,
              44,
              45,
              46,
              47,
              48
            ],
            "link_a": "base_link",
            "link_b": "Link2",
            "result": "candidate-overlap"
          },
          {
            "candidate_interval_indices": [],
            "link_a": "base_link",
            "link_b": "Link3",
            "result": "separated-by-conservative-aabb"
          },
          {
            "candidate_interval_indices": [],
            "link_a": "base_link",
            "link_b": "Link4",
            "result": "separated-by-conservative-aabb"
          },
          {
            "candidate_interval_indices": [],
            "link_a": "base_link",
            "link_b": "Link5",
            "result": "separated-by-conservative-aabb"
          },
          {
            "candidate_interval_indices": [],
            "link_a": "base_link",
            "link_b": "Link6",
            "result": "separated-by-conservative-aabb"
          },
          {
            "candidate_interval_indices": [],
            "link_a": "Link1",
            "link_b": "Link3",
            "result": "separated-by-conservative-aabb"
          },
          {
            "candidate_interval_indices": [],
            "link_a": "Link1",
            "link_b": "Link4",
            "result": "separated-by-conservative-aabb"
          },
          {
            "candidate_interval_indices": [],
            "link_a": "Link1",
            "link_b": "Link5",
            "result": "separated-by-conservative-aabb"
          },
          {
            "candidate_interval_indices": [],
            "link_a": "Link1",
            "link_b": "Link6",
            "result": "separated-by-conservative-aabb"
          },
          {
            "candidate_interval_indices": [],
            "link_a": "Link2",
            "link_b": "Link4",
            "result": "separated-by-conservative-aabb"
          },
          {
            "candidate_interval_indices": [
              38,
              39,
              40,
              41
            ],
            "link_a": "Link2",
            "link_b": "Link5",
            "result": "candidate-overlap"
          },
          {
            "candidate_interval_indices": [
              17,
              18,
              19,
              20,
              21,
              22,
              23,
              24,
              25,
              26,
              27,
              28,
              29,
              30,
              31,
              32,
              33,
              34,
              35,
              36,
              37,
              38,
              39
            ],
            "link_a": "Link2",
            "link_b": "Link6",
            "result": "candidate-overlap"
          },
          {
            "candidate_interval_indices": [
              0,
              1,
              2,
              3,
              4,
              5,
              6,
              7,
              8,
              9,
              10,
              11,
              12,
              13,
              14,
              15,
              16,
              17,
              18,
              19,
              20,
              21,
              22,
              23,
              24,
              25,
              26,
              27,
              28,
              29,
              30,
              31,
              32,
              33,
              34,
              35,
              36,
              37,
              38,
              39,
              40,
              41,
              42,
              43,
              44,
              45,
              46,
              47,
              48
            ],